{
  "$schema": "http://json-schema.org/draft-07/schema#",
  "title": "UI8Kit Registry Item",
  "description": "Schema for individual registry items in the UI8Kit component system",
  "type": "object",
  "properties": {
    "$schema": {
      "type": "string"
    },
    "name": {
      "type": "string"
    },
    "type": {
      "type": "string",
      "enum": [
        "registry:lib",
        "registry:block",
        "registry:component",
        "registry:ui",
        "registry:composite",
        "registry:layout",
        "registry:variants"
      ]
    },
    "title": {
      "type": "string"
    },
    "description": {
      "type": "string"
    },
    "dependencies": {
      "type": "array",
      "items": {
        "type": "string"
      },
      "default": []
    },
    "devDependencies": {
      "type": "array",
      "items": {
        "type": "string"
      },
      "default": []
    },
    "registryDependencies": {
      "type": "array",
      "items": {
        "type": "string"
      }
    },
    "files": {
      "type": "array",
      "items": {
        "type": "object",
        "properties": {
          "path": {
            "type": "string"
          },
          "content": {
            "type": "string"
          },
          "target": {
            "type": "string"
          }
        },
        "required": [
          "path"
        ],
        "additionalProperties": false
      }
    },
    "tailwind": {
      "type": "object",
      "properties": {
        "config": {
          "type": "object",
          "properties": {
            "content": {
              "type": "array",
              "items": {
                "type": "string"
              }
            },
            "theme": {
              "type": "object",
              "additionalProperties": {}
            },
            "plugins": {
              "type": "array",
              "items": {
                "type": "string"
              }
            }
          },
          "additionalProperties": false
        }
      },
      "additionalProperties": false
    },
    "cssVars": {
      "type": "object",
      "properties": {
        "theme": {
          "type": "object",
          "additionalProperties": {
            "type": "string"
          }
        },
        "light": {
          "type": "object",
          "additionalProperties": {
            "type": "string"
          }
        },
        "dark": {
          "type": "object",
          "additionalProperties": {
            "type": "string"
          }
        }
      },
      "additionalProperties": false
    },
    "meta": {
      "type": "object",
      "additionalProperties": {}
    }
  },
  "required": [
    "name",
    "type",
    "files"
  ],
  "additionalProperties": false
}