{
  "$schema": "https://ui.buildy.tw/schema/registry-item.json",
  "name": "utils",
  "type": "registry:lib",
  "description": "",
  "dependencies": [
    "clsx",
    "tailwind-merge"
  ],
  "devDependencies": [],
  "registryDependencies": [],
  "files": [
    {
      "path": "src/lib/utils.ts",
      "content": "import { clsx, type ClassValue } from \"clsx\";\r\nimport { twMerge } from \"tailwind-merge\";\r\n\r\nexport function cn(...inputs: ClassValue[]) {\r\n  return twMerge(clsx(inputs));\r\n} ",
      "target": "lib"
    }
  ]
}