{
  "$schema": "https://ui.buildy.tw/schema/registry-item.json",
  "name": "Card",
  "type": "registry:composite",
  "description": "Main Card component interface (CDL utility-props + variant)",
  "dependencies": [
    "react"
  ],
  "devDependencies": [],
  "registryDependencies": [],
  "files": [
    {
      "path": "src/components/Card.tsx",
      "content": "import type { ReactNode } from \"react\";\r\nimport { forwardRef } from \"react\";\r\nimport { cn } from \"../lib/utils\";\r\nimport { resolveUtilityClassName, ux, type UtilityPropBag, type UtilityPropPrefix } from \"../lib/utility-props\";\r\nimport { cardVariants, cardHeaderVariants, cardTitleVariants, cardDescriptionVariants, cardContentVariants, cardFooterVariants, type CardVariantProps } from \"../variants/card\";\r\n\r\ntype CardDomProps = Omit<React.HTMLAttributes<HTMLDivElement>, UtilityPropPrefix>;\r\n\r\n// Main Card component interface (CDL utility-props + variant)\r\ninterface CardProps extends CardDomProps, UtilityPropBag, CardVariantProps {\r\n  children: ReactNode;\r\n}\r\n\r\nconst Card = forwardRef<HTMLDivElement, CardProps>(\r\n  ({ \r\n    children, \r\n    className,\r\n    variant = \"default\",\r\n    ...props \r\n  }, ref) => {\r\n    const { utilityClassName, rest } = resolveUtilityClassName(props);\r\n    const defaultUtilities = ux({\r\n      p: \"4\",\r\n      rounded: \"lg\",\r\n      shadow: \"sm\",\r\n      bg: \"card\",\r\n      // minimal border baseline (no color enforcement here; color comes from tokens/theme)\r\n      border: \"\",\r\n    });\r\n    return (\r\n      <div\r\n        ref={ref}\r\n        data-class=\"card\"\r\n        className={cn(\r\n          cardVariants({ variant }),\r\n          defaultUtilities,\r\n          utilityClassName,\r\n          className\r\n        )}\r\n        {...rest}\r\n      >\r\n        {children}\r\n      </div>\r\n    );\r\n  }\r\n);\r\n\r\nCard.displayName = \"Card\";\r\n\r\n// Card.Header component\r\ninterface CardHeaderProps \r\n  extends Omit<React.HTMLAttributes<HTMLDivElement>, UtilityPropPrefix>,\r\n    UtilityPropBag {\r\n  children: ReactNode;\r\n}\r\n\r\nconst CardHeader = forwardRef<HTMLDivElement, CardHeaderProps>(\r\n  ({ \r\n    children, \r\n    className,\r\n    ...props \r\n  }, ref) => {\r\n    const { utilityClassName, rest } = resolveUtilityClassName(props);\r\n    const defaultUtilities = ux({ p: \"4\" });\r\n    return (\r\n      <div\r\n        ref={ref}\r\n        data-class=\"card-header\"\r\n        className={cn(\r\n          cardHeaderVariants(),\r\n          defaultUtilities,\r\n          utilityClassName,\r\n          className\r\n        )}\r\n        {...rest}\r\n      >\r\n        {children}\r\n      </div>\r\n    );\r\n  }\r\n);\r\n\r\nCardHeader.displayName = \"CardHeader\";\r\n\r\n// Card.Title component\r\ninterface CardTitleProps\r\n  extends React.HTMLAttributes<HTMLHeadingElement> {\r\n  children: ReactNode;\r\n  order?: 1 | 2 | 3 | 4 | 5 | 6;\r\n}\r\n\r\nconst CardTitle = forwardRef<HTMLHeadingElement, CardTitleProps>(\r\n  ({\r\n    children,\r\n    className,\r\n    order = 3,\r\n    ...props\r\n  }, ref) => {\r\n    // Create props for the heading element\r\n    const headingProps = {\r\n      ref,\r\n      'data-class': 'card-title',\r\n      className: cn(\r\n        cardTitleVariants(),\r\n        className\r\n      ),\r\n      ...props\r\n    };\r\n\r\n    // Return the appropriate heading element\r\n    switch (order) {\r\n      case 1:\r\n        return <h1 {...headingProps}>{children}</h1>;\r\n      case 2:\r\n        return <h2 {...headingProps}>{children}</h2>;\r\n      case 3:\r\n        return <h3 {...headingProps}>{children}</h3>;\r\n      case 4:\r\n        return <h4 {...headingProps}>{children}</h4>;\r\n      case 5:\r\n        return <h5 {...headingProps}>{children}</h5>;\r\n      case 6:\r\n        return <h6 {...headingProps}>{children}</h6>;\r\n      default:\r\n        return <h3 {...headingProps}>{children}</h3>;\r\n    }\r\n  }\r\n);\r\n\r\nCardTitle.displayName = \"CardTitle\";\r\n\r\n// Card.Description component\r\ninterface CardDescriptionProps \r\n  extends React.HTMLAttributes<HTMLParagraphElement> {\r\n  children: ReactNode;\r\n}\r\n\r\nconst CardDescription = forwardRef<HTMLParagraphElement, CardDescriptionProps>(\r\n  ({ children, className, ...props }, ref) => (\r\n    <p\r\n      ref={ref}\r\n      data-class=\"card-description\"\r\n      className={cn(\r\n        cardDescriptionVariants(),\r\n        className\r\n      )}\r\n      {...props}\r\n    >\r\n      {children}\r\n    </p>\r\n  )\r\n);\r\n\r\nCardDescription.displayName = \"CardDescription\";\r\n\r\n// Card.Content component\r\ninterface CardContentProps \r\n  extends Omit<React.HTMLAttributes<HTMLDivElement>, UtilityPropPrefix>,\r\n    UtilityPropBag {\r\n  children: ReactNode;\r\n}\r\n\r\nconst CardContent = forwardRef<HTMLDivElement, CardContentProps>(\r\n  ({ \r\n    children, \r\n    className,\r\n    ...props \r\n  }, ref) => {\r\n    const { utilityClassName, rest } = resolveUtilityClassName(props);\r\n    const defaultUtilities = ux({ p: \"4\" });\r\n    return (\r\n      <div\r\n        ref={ref}\r\n        data-class=\"card-content\"\r\n        className={cn(\r\n          cardContentVariants(),\r\n          defaultUtilities,\r\n          utilityClassName,\r\n          className\r\n        )}\r\n        {...rest}\r\n      >\r\n        {children}\r\n      </div>\r\n    );\r\n  }\r\n);\r\n\r\nCardContent.displayName = \"CardContent\";\r\n\r\n// Card.Footer component\r\ninterface CardFooterProps \r\n  extends Omit<React.HTMLAttributes<HTMLDivElement>, UtilityPropPrefix>,\r\n    UtilityPropBag {\r\n  children: ReactNode;\r\n}\r\n\r\nconst CardFooter = forwardRef<HTMLDivElement, CardFooterProps>(\r\n  ({ \r\n    children, \r\n    className,\r\n    ...props \r\n  }, ref) => {\r\n    const { utilityClassName, rest } = resolveUtilityClassName(props);\r\n    const defaultUtilities = ux({ p: \"4\" });\r\n    return (\r\n      <div\r\n        ref={ref}\r\n        data-class=\"card-footer\"\r\n        className={cn(\r\n          cardFooterVariants(),\r\n          defaultUtilities,\r\n          utilityClassName,\r\n          className\r\n        )}\r\n        {...rest}\r\n      >\r\n        {children}\r\n      </div>\r\n    );\r\n  }\r\n);\r\n\r\nCardFooter.displayName = \"CardFooter\";\r\n\r\n// Compound Card component\r\nconst CompoundCard = Object.assign(Card, {\r\n  Header: CardHeader,\r\n  Title: CardTitle,\r\n  Description: CardDescription,\r\n  Content: CardContent,\r\n  Footer: CardFooter,\r\n});\r\n\r\n// Export types and components\r\nexport type {\r\n  CardProps,\r\n  CardHeaderProps,\r\n  CardTitleProps,\r\n  CardDescriptionProps,\r\n  CardContentProps,\r\n  CardFooterProps\r\n};\r\nexport { CompoundCard as Card, CardHeader, CardTitle, CardDescription, CardContent, CardFooter }; ",
      "target": "components"
    }
  ]
}