{
  "$schema": "https://ui.buildy.tw/schema/registry-item.json",
  "name": "Field",
  "type": "registry:ui",
  "description": "Base field props — variant (style) + component (element) + utility props.",
  "dependencies": [
    "react"
  ],
  "devDependencies": [],
  "registryDependencies": [],
  "files": [
    {
      "path": "src/components/ui/Field.tsx",
      "content": "import type { ComponentPropsWithoutRef, Ref } from \"react\";\r\nimport { forwardRef } from \"react\";\r\nimport { cn } from \"../../lib/utils\";\r\nimport {\r\n  resolveUtilityClassName,\r\n  type UtilityPropBag,\r\n  type UtilityPropPrefix,\r\n} from \"../../lib/utility-props\";\r\nimport {\r\n  fieldVariantVariants,\r\n  fieldControlVariants,\r\n  fieldButtonVariants,\r\n  fieldSizeVariants,\r\n  fieldControlSizeVariants,\r\n  fieldTextareaBase,\r\n  type FieldVariantProps,\r\n} from \"../../variants/field\";\r\n\r\ntype FieldComponent = \"input\" | \"textarea\" | \"select\" | \"button\";\r\n\r\n/**\r\n * Base field props — variant (style) + component (element) + utility props.\r\n */\r\ntype FieldBaseProps = UtilityPropBag &\r\n  FieldVariantProps & {\r\n    component?: FieldComponent;\r\n    className?: string;\r\n  };\r\n\r\ntype FieldInputProps = FieldBaseProps &\r\n  Omit<ComponentPropsWithoutRef<\"input\">, keyof FieldBaseProps | UtilityPropPrefix>;\r\n\r\ntype FieldTextareaProps = FieldBaseProps &\r\n  Omit<\r\n    ComponentPropsWithoutRef<\"textarea\">,\r\n    keyof FieldBaseProps | UtilityPropPrefix\r\n  >;\r\n\r\ntype FieldSelectProps = FieldBaseProps &\r\n  Omit<\r\n    ComponentPropsWithoutRef<\"select\">,\r\n    keyof FieldBaseProps | UtilityPropPrefix\r\n  >;\r\n\r\ntype FieldButtonProps = FieldBaseProps &\r\n  Omit<\r\n    ComponentPropsWithoutRef<\"button\">,\r\n    keyof FieldBaseProps | UtilityPropPrefix\r\n  >;\r\n\r\nexport type FieldProps =\r\n  | (FieldInputProps & { component?: \"input\" })\r\n  | (FieldTextareaProps & { component: \"textarea\" })\r\n  | (FieldSelectProps & { component: \"select\" })\r\n  | (FieldButtonProps & { component: \"button\" });\r\n\r\nfunction isTextareaProps(props: FieldProps): props is FieldTextareaProps & { component: \"textarea\" } {\r\n  return props.component === \"textarea\";\r\n}\r\n\r\nfunction isSelectProps(props: FieldProps): props is FieldSelectProps & { component: \"select\" } {\r\n  return props.component === \"select\";\r\n}\r\n\r\nfunction isButtonProps(props: FieldProps): props is FieldButtonProps & { component: \"button\" } {\r\n  return props.component === \"button\";\r\n}\r\n\r\n/**\r\n * Field — polymorphic form control. Style via variant (default, outline, ghost).\r\n * Element via component: \"input\" (default), \"textarea\", \"select\", \"button\".\r\n *\r\n * @example\r\n * ```tsx\r\n * <Field type=\"email\" placeholder=\"Email\" />\r\n * <Field component=\"textarea\" rows={4} placeholder=\"Message\" />\r\n * <Field type=\"checkbox\" />\r\n * <Field type=\"radio\" name=\"choice\" value=\"a\" />\r\n * <Field component=\"select\"><option>One</option></Field>\r\n * <Field component=\"button\" type=\"submit\">Submit</Field>\r\n * <Field variant=\"outline\" type=\"email\" />\r\n * <Field variant=\"ghost\" component=\"textarea\" />\r\n * ```\r\n */\r\nexport const Field = forwardRef<\r\n  HTMLInputElement | HTMLTextAreaElement | HTMLSelectElement | HTMLButtonElement,\r\n  FieldProps\r\n>(function Field(props, ref) {\r\n  const {\r\n    component = \"input\",\r\n    variant = \"default\",\r\n    size = \"default\",\r\n    className,\r\n    ...rest\r\n  } = props;\r\n\r\n  const { utilityClassName, rest: elementProps } = resolveUtilityClassName(rest);\r\n\r\n  const inputType = (elementProps as Record<string, unknown>).type as string | undefined;\r\n  const isCheckbox = component === \"input\" && inputType === \"checkbox\";\r\n  const isRadio = component === \"input\" && inputType === \"radio\";\r\n  const isControl = isCheckbox || isRadio;\r\n  const isButton = component === \"button\";\r\n\r\n  const styleClasses = isButton\r\n    ? fieldButtonVariants({ variant })\r\n    : isControl\r\n      ? fieldControlVariants({ variant })\r\n      : fieldVariantVariants({ variant });\r\n  const sizeClasses = isControl\r\n    ? fieldControlSizeVariants({ size })\r\n    : isButton\r\n      ? \"\" // button has its own padding\r\n      : fieldSizeVariants({ size });\r\n\r\n  const combinedClassName = cn(\r\n    styleClasses,\r\n    sizeClasses,\r\n    component === \"textarea\" && fieldTextareaBase,\r\n    isCheckbox && \"rounded\",\r\n    isRadio && \"rounded-full\",\r\n    utilityClassName,\r\n    className\r\n  );\r\n\r\n  const dataClass = (elementProps as Record<string, unknown>)[\"data-class\"] ?? \"field\";\r\n\r\n  if (isTextareaProps(props)) {\r\n    const textareaProps = elementProps as ComponentPropsWithoutRef<\"textarea\">;\r\n    return (\r\n      <textarea\r\n        ref={ref as Ref<HTMLTextAreaElement>}\r\n        data-class={dataClass}\r\n        className={combinedClassName}\r\n        {...textareaProps}\r\n      />\r\n    );\r\n  }\r\n\r\n  if (isSelectProps(props)) {\r\n    const selectProps = elementProps as ComponentPropsWithoutRef<\"select\">;\r\n    return (\r\n      <select\r\n        ref={ref as Ref<HTMLSelectElement>}\r\n        data-class={dataClass}\r\n        className={combinedClassName}\r\n        {...selectProps}\r\n      />\r\n    );\r\n  }\r\n\r\n  if (isButtonProps(props)) {\r\n    const buttonProps = elementProps as ComponentPropsWithoutRef<\"button\">;\r\n    const btnType = (buttonProps.type ?? \"button\") as \"button\" | \"reset\" | \"submit\";\r\n    return (\r\n      <button\r\n        ref={ref as Ref<HTMLButtonElement>}\r\n        data-class={dataClass}\r\n        className={combinedClassName}\r\n        {...buttonProps}\r\n        type={btnType}\r\n      />\r\n    );\r\n  }\r\n\r\n  // input: text, email, password, checkbox, radio, etc.\r\n  const inputProps = { ...elementProps } as Record<string, unknown>;\r\n  if (!inputProps.type) {\r\n    inputProps.type = \"text\";\r\n  }\r\n\r\n  return (\r\n    <input\r\n      ref={ref as Ref<HTMLInputElement>}\r\n      data-class={dataClass}\r\n      className={combinedClassName}\r\n      {...inputProps}\r\n    />\r\n  );\r\n});\r\n\r\nField.displayName = \"Field\";\r\n",
      "target": "components/ui"
    }
  ]
}