{
  "$schema": "https://ui.buildy.tw/schema/registry-item.json",
  "name": "utility-props",
  "type": "registry:lib",
  "description": "Strict utility-prop value:\r\n * - allows only values listed in `utilityPropsMap` for the given prefix\r\n * - additionally allows numeric literals when the map contains numeric strings (e.g. \"8\" -> 8)\r\n * - allows `true` / \"\" only when the map contains a bare token \"\" (e.g. flex, block, absolute)\r\n * - allows false/null/undefined to omit the class",
  "dependencies": [],
  "devDependencies": [],
  "registryDependencies": [],
  "files": [
    {
      "path": "src/lib/utility-props.ts",
      "content": "import { cn } from \"./utils\";\r\nimport { utilityPropsMap } from \"./utility-props.map\";\r\n\r\nexport type UtilityPropPrefix = keyof typeof utilityPropsMap;\r\n\r\ntype UtilityMap = typeof utilityPropsMap;\r\n\r\ntype UtilityAllowed<P extends UtilityPropPrefix> = UtilityMap[P][number];\r\n\r\ntype NumericFromString<S> = S extends `${infer N extends number}` ? N : never;\r\ntype UtilityNumeric<P extends UtilityPropPrefix> = NumericFromString<UtilityAllowed<P>>;\r\n\r\ntype HasBareToken<P extends UtilityPropPrefix> = \"\" extends UtilityAllowed<P> ? true : false;\r\n\r\n/**\r\n * Strict utility-prop value:\r\n * - allows only values listed in `utilityPropsMap` for the given prefix\r\n * - additionally allows numeric literals when the map contains numeric strings (e.g. \"8\" -> 8)\r\n * - allows `true` / \"\" only when the map contains a bare token \"\" (e.g. flex, block, absolute)\r\n * - allows false/null/undefined to omit the class\r\n */\r\nexport type UtilityPropInput<P extends UtilityPropPrefix> =\r\n  | Exclude<UtilityAllowed<P>, \"\">\r\n  | UtilityNumeric<P>\r\n  | (HasBareToken<P> extends true ? \"\" | true : never);\r\n\r\nexport type UtilityPropBag = {\r\n  [P in UtilityPropPrefix]?: UtilityPropInput<P> | false | null | undefined;\r\n};\r\n\r\nexport type UtilityPropValue<P extends UtilityPropPrefix> =\r\n  | UtilityPropInput<P>\r\n  | null\r\n  | undefined;\r\n\r\n/**\r\n * Fast utility props -> className resolver (NO runtime validation).\r\n *\r\n * Use this when whitelist checks are enforced by scripts/guards and you want\r\n * the runtime to be as cheap as simple `cn(...)`.\r\n */\r\nconst FLEX_DIR_VALUES = ['col', 'row', 'col-reverse', 'row-reverse'] as const;\r\n\r\nconst GAP_SEMANTIC: Record<string, string> = {\r\n  xs: \"1\",\r\n  sm: \"2\",\r\n  md: \"4\",\r\n  lg: \"6\",\r\n  xl: \"8\",\r\n};\r\n\r\nexport function ux(props: UtilityPropBag): string {\r\n  const tokens: string[] = [];\r\n\r\n  for (const [k, raw] of Object.entries(props)) {\r\n    if (raw === null || raw === undefined || raw === false) continue;\r\n\r\n    if (raw === true) {\r\n      tokens.push(k);\r\n      continue;\r\n    }\r\n\r\n    const value = String(raw).trim();\r\n    if (!value) {\r\n      tokens.push(k);\r\n      continue;\r\n    }\r\n\r\n    // Bare-token alias: italic=\"italic\" → \"italic\" (when map allows \"\")\r\n    const allowed = (utilityPropsMap as Record<string, string[] | undefined>)[k];\r\n    if (allowed?.includes(\"\") && value === k) {\r\n      tokens.push(k);\r\n      continue;\r\n    }\r\n\r\n    // flex=\"col\"|\"row\"|... → \"flex\" + \"flex-col\" (direction implies display: flex)\r\n    if (k === 'flex' && (FLEX_DIR_VALUES as readonly string[]).includes(value)) {\r\n      tokens.push('flex', `flex-${value}`);\r\n      continue;\r\n    }\r\n\r\n    // gap=\"md\"|\"lg\"|... → \"gap-4\"|\"gap-6\"|... (semantic spacing)\r\n    if (k === 'gap' && value in GAP_SEMANTIC) {\r\n      tokens.push(`gap-${GAP_SEMANTIC[value as keyof typeof GAP_SEMANTIC]}`);\r\n      continue;\r\n    }\r\n\r\n    tokens.push(`${k}-${value}`);\r\n  }\r\n\r\n  return tokens.join(\" \");\r\n}\r\n\r\nexport function uxcn(props: UtilityPropBag, ...rest: Parameters<typeof cn>) {\r\n  return cn(ux(props), ...rest);\r\n}\r\n\r\n/**\r\n * Split any props object into:\r\n * - `utility`: keys that match the generated `utilityProps` map\r\n * - `rest`: everything else (safe to spread on DOM elements)\r\n *\r\n * This allows components to support `grid=\"cols-12\"` / `gap=\"2\"` etc. without\r\n * listing keys manually per component.\r\n *\r\n * Note: this function does NOT validate values at runtime. Whitelist validation\r\n * is expected to be enforced by scripts/guards in the workflow.\r\n */\r\nexport function splitUtilityProps<T extends Record<string, any>>(props: T): {\r\n  utility: UtilityPropBag;\r\n  rest: Omit<T, UtilityPropPrefix>;\r\n} {\r\n  const utility: UtilityPropBag = {};\r\n  const rest: Record<string, any> = {};\r\n\r\n  for (const [k, v] of Object.entries(props)) {\r\n    if (k in utilityPropsMap) {\r\n      (utility as any)[k] = v;\r\n      continue;\r\n    }\r\n    rest[k] = v;\r\n  }\r\n\r\n  return { utility, rest: rest as any };\r\n}\r\n\r\nexport function resolveUtilityClassName<T extends Record<string, any>>(props: T): {\r\n  utilityClassName: string;\r\n  rest: Omit<T, UtilityPropPrefix>;\r\n} {\r\n  const { utility, rest } = splitUtilityProps(props);\r\n  return { utilityClassName: ux(utility), rest };\r\n}\r\n\r\nexport { utilityPropsMap };\r\n\r\n// =============================================================================\r\n// MISSING UTILITY CLASSES (to be added to CDL whitelist)\r\n// =============================================================================\r\n// These classes were discovered during component refactoring but are not yet\r\n// in the utility-props.generated.ts map. Add them to CDL whitelist and regenerate.\r\n//\r\n// FOUND IN Group.tsx:\r\n// - min-w-0 (for preventGrowOverflow prop - now always enabled by default)\r\n//\r\n// FOUND HARDCODED VARIANTS (need proper CDL variants):\r\n// - Icon.tsx: size variants (xs, sm, md, lg, xl) - currently hardcoded sizeProps object\r\n// - Image.tsx: fit variants (contain, cover, fill, none, scale-down) - currently hardcoded fitProps object\r\n// - Image.tsx: position variants (bottom, center, left, left-bottom, etc.) - currently hardcoded positionProps object\r\n// - Image.tsx: aspect variants (auto, square, video) - currently hardcoded aspectProps object\r\n// - Text.tsx: typography variants (size, weight, align, leading, tracking, modifiers) - currently removed, use utility props\r\n// - Title.tsx: typography variants (size, weight, align, leading, tracking, truncate) - currently removed, use utility props\r\n//\r\n// COMPONENTS PLANNED FOR CDL UTILITY PROPS MIGRATION:\r\n// - Grid.tsx: Currently uses gridVariants CVA, planned for utility props migration\r\n//   * MISSING GRID CLASSES TO ADD TO WHITELIST:\r\n//     - grid-cols-7, grid-cols-8, grid-cols-9, grid-cols-10, grid-cols-11\r\n//     - gap-3, gap-5, gap-md, gap-lg, gap-xl, gap-xs, gap-sm (currently only 0,1,2,4,6,8,10,12)\r\n//     - items-baseline (already exists), items-stretch (already exists)\r\n//     - justify-items-* variants\r\n//     - content-* (content-start, content-center, etc.)\r\n//     - col-span-*, col-start-*, col-end-* (currently missing col-span entirely)\r\n//     - order-* (currently missing entirely)\r\n//   * Complex responsive patterns (cols rule lists like \"1-2\", \"1-3\") need special CDL handling\r\n//   * Auto-rows/cols classes need verification\r\n//   * STEP 1: Add missing grid classes to CDL whitelist\r\n//   * STEP 2: Regenerate utility-props.generated.ts\r\n//   * STEP 3: Migrate Grid.tsx from gridVariants to utility props\r\n//   * STEP 4: Update Grid.Col to use utility props instead of gridVariants\r\n//\r\n// SOLUTION: Create CDL variant generation for component-specific variants\r\n// 1. Add variant definitions to .project/cdl/variants.json:\r\n//    {\r\n//      \"icon\": {\r\n//        \"size\": {\r\n//          \"xs\": { \"w\": \"3\", \"h\": \"3\" },\r\n//          \"sm\": { \"w\": \"4\", \"h\": \"4\" },\r\n//          ...\r\n//        }\r\n//      },\r\n//      \"image\": {\r\n//        \"fit\": { \"contain\": { \"object\": \"contain\" }, ... },\r\n//        \"position\": { \"center\": { \"object\": \"center\" }, ... },\r\n//        \"aspect\": { \"square\": { \"aspect\": \"square\" }, ... }\r\n//      }\r\n//    }\r\n// 2. Generate variant functions via scripts/cdl-emit-component-variants.mjs\r\n// 3. Replace hardcoded objects with generated functions:\r\n//    const sizeClasses = iconVariants({ size });\r\n//    const fitClasses = imageVariants({ fit });\r\n//\r\n// POTENTIAL FUTURE NEEDS (anticipate based on common UI patterns):\r\n// - min-w-full, min-w-max, min-w-min, min-w-fit\r\n// - max-w-0, max-w-none, max-w-xs, max-w-sm, max-w-md, etc.\r\n// - flex-auto, flex-initial, flex-none\r\n// - grow-0, shrink-0, shrink\r\n// - basis-auto, basis-full, basis-0\r\n// - aspect-square, aspect-video, aspect-auto\r\n// - object-contain, object-cover, object-fill, object-none, object-scale-down\r\n// - mix-blend-multiply, mix-blend-screen, etc.\r\n// - backdrop-blur, backdrop-brightness, backdrop-contrast, etc.\r\n//\r\n// ADD TO CDL WHITELIST: scripts/cdl-whitelist.mjs or .project/cdl/whitelist.json\r\n// THEN REGENERATE: bun run cdl:utilities:emit\r\n// =============================================================================\r\n\r\n\r\n",
      "target": "lib"
    }
  ]
}