{
  "$schema": "https://ui.buildy.tw/schema/registry-item.json",
  "name": "button",
  "type": "registry:variants",
  "description": "Button size variants",
  "dependencies": [
    "class-variance-authority"
  ],
  "devDependencies": [],
  "registryDependencies": [],
  "files": [
    {
      "path": "src/variants/button.ts",
      "content": "import { cva, type VariantProps } from \"class-variance-authority\";\r\n\r\n// Button size variants\r\nexport const buttonSizeVariants = cva(\"\", {\r\n  variants: {\r\n    size: {\r\n      xs: \"h-6 px-2 text-xs\",\r\n      sm: \"h-9 px-3 text-sm\", \r\n      default: \"h-10 px-4 py-2\",\r\n      md: \"h-10 px-4 py-2\",\r\n      lg: \"h-11 px-8\",\r\n      xl: \"h-12 px-10 text-base\",\r\n      icon: \"h-10 w-10\"\r\n    }\r\n  },\r\n  defaultVariants: {\r\n    size: \"default\"\r\n  }\r\n});\r\n\r\n// Button style variants\r\nexport const buttonStyleVariants = cva(\"inline-flex items-center justify-center gap-2 whitespace-nowrap text-sm font-medium rounded transition-colors shrink-0 outline-none\", {\r\n  variants: {\r\n    variant: {\r\n      default: \"bg-primary text-primary-foreground\",\r\n      primary: \"bg-primary text-primary-foreground\",\r\n      destructive: \"bg-destructive text-destructive-foreground\",\r\n      outline: \"border border-input bg-background\",\r\n      secondary: \"bg-secondary text-secondary-foreground\",\r\n      ghost: \"bg-accent text-accent-foreground\",\r\n      link: \"text-primary underline-offset-4\"\r\n    }\r\n  },\r\n  defaultVariants: {\r\n    variant: \"default\"\r\n  }\r\n});\r\n\r\nexport interface ButtonSizeVariantProps extends VariantProps<typeof buttonSizeVariants> {}\r\nexport interface ButtonStyleVariantProps extends VariantProps<typeof buttonStyleVariants> {}\r\nexport type ButtonVariantProps = VariantProps<typeof buttonStyleVariants> & VariantProps<typeof buttonSizeVariants>;",
      "target": "variants"
    }
  ]
}