{
  "$schema": "https://ui.buildy.tw/schema/registry-item.json",
  "name": "Stack",
  "type": "registry:ui",
  "description": "",
  "dependencies": [
    "react"
  ],
  "devDependencies": [],
  "registryDependencies": [],
  "files": [
    {
      "path": "src/components/ui/Stack.tsx",
      "content": "import type { ElementType, ReactNode } from \"react\";\r\nimport { forwardRef } from \"react\";\r\nimport { cn } from \"../../lib/utils\";\r\nimport { resolveUtilityClassName, ux, type UtilityPropBag, type UtilityPropPrefix } from \"../../lib/utility-props\";\r\n\r\ntype StackDomProps = Omit<React.HTMLAttributes<HTMLElement>, UtilityPropPrefix>;\r\n\r\nexport type StackProps\r\n  = StackDomProps &\r\n    UtilityPropBag & {\r\n  children: ReactNode;\r\n  component?: ElementType;\r\n};\r\n\r\nconst defaultProps = ux({\r\n  flex: 'col',     // display: flex + flex-direction: column\r\n  gap: '4',        // gap: 1rem\r\n  items: 'start',  // align-items: flex-start\r\n  justify: 'start' // justify-content: flex-start\r\n});\r\n\r\nexport const Stack = forwardRef<HTMLElement, StackProps>(\r\n  ({\r\n    children,\r\n    className,\r\n    component = 'div',\r\n    ...props\r\n  }, ref) => {\r\n    const { utilityClassName, rest } = resolveUtilityClassName(props);\r\n    const Element = component as ElementType;\r\n\r\n    return (\r\n      <Element\r\n        ref={ref}\r\n        data-class=\"stack\"\r\n        className={cn(\r\n          defaultProps,\r\n          utilityClassName,\r\n          className\r\n        )}\r\n        {...rest}\r\n      >\r\n        {children}\r\n      </Element>\r\n    );\r\n  }\r\n);\r\n\r\nStack.displayName = \"Stack\"; ",
      "target": "components/ui"
    }
  ]
}