{
  "$schema": "https://ui.buildy.tw/schema/registry-item.json",
  "name": "Image",
  "type": "registry:ui",
  "description": "Simple fit variants - single class each, handled via ux()",
  "dependencies": [
    "react"
  ],
  "devDependencies": [],
  "registryDependencies": [],
  "files": [
    {
      "path": "src/components/ui/Image.tsx",
      "content": "import { forwardRef } from \"react\";\r\nimport { cn } from \"../../lib/utils\";\r\nimport { resolveUtilityClassName, ux, type UtilityPropBag, type UtilityPropPrefix } from \"../../lib/utility-props\";\r\nimport { imagePositionVariants } from \"../../variants/image\";\r\n\r\ntype ImageDomProps = Omit<React.ImgHTMLAttributes<HTMLImageElement>, UtilityPropPrefix | 'width' | 'height'>;\r\n\r\nexport type ImageProps\r\n  = ImageDomProps &\r\n    UtilityPropBag & {\r\n  width?: string | number;\r\n  height?: string | number;\r\n  fallbackSrc?: string;\r\n  withPlaceholder?: boolean;\r\n  fit?: 'contain' | 'cover' | 'fill' | 'none' | 'scale-down';\r\n  position?: 'bottom' | 'center' | 'left' | 'left-bottom' | 'left-top' | 'right' | 'right-bottom' | 'right-top' | 'top';\r\n  aspect?: 'auto' | 'square' | 'video';\r\n};\r\n\r\nconst defaultProps = ux({\r\n  max: 'w-full',   // max-width: 100%\r\n  h: 'auto'        // height: auto\r\n});\r\n\r\n// Simple fit variants - single class each, handled via ux()\r\nconst fitProps = {\r\n  contain: ux({ object: 'contain' }),\r\n  cover: ux({ object: 'cover' }),\r\n  fill: ux({ object: 'fill' }),\r\n  none: ux({ object: 'none' }),\r\n  'scale-down': ux({ object: 'scale-down' })\r\n};\r\n\r\n// Simple position variants - single class each, handled via ux()\r\nconst simplePositionProps = {\r\n  bottom: ux({ object: 'bottom' }),\r\n  center: ux({ object: 'center' }),\r\n  left: ux({ object: 'left' }),\r\n  right: ux({ object: 'right' }),\r\n  top: ux({ object: 'top' })\r\n};\r\n\r\n// Aspect ratio variants - single class each, handled via ux()\r\nconst aspectProps = {\r\n  auto: ux({ aspect: 'auto' }),\r\n  square: ux({ aspect: 'square' }),\r\n  video: ux({ aspect: 'video' })\r\n};\r\n\r\nexport const Image = forwardRef<HTMLImageElement, ImageProps>(\r\n  ({\r\n    className,\r\n    src,\r\n    alt,\r\n    width,\r\n    height,\r\n    fit = 'cover',\r\n    position = 'center',\r\n    aspect = 'auto',\r\n    fallbackSrc,\r\n    withPlaceholder = false,\r\n    onError,\r\n    ...props\r\n  }, ref) => {\r\n    const { utilityClassName, rest } = resolveUtilityClassName(props);\r\n\r\n    const handleError = (e: React.SyntheticEvent<HTMLImageElement, Event>) => {\r\n      if (fallbackSrc) {\r\n        e.currentTarget.src = fallbackSrc;\r\n      }\r\n      onError?.(e);\r\n    };\r\n\r\n    const fitClasses = fitProps[fit];\r\n    const aspectClasses = aspectProps[aspect];\r\n    const placeholderClasses = withPlaceholder ? ux({ bg: 'muted' }) : '';\r\n    \r\n    // Handle position: use variants for combinations, ux() for simple positions\r\n    const isCombinedPosition = position && ['left-bottom', 'left-top', 'right-bottom', 'right-top'].includes(position);\r\n    const positionClasses = isCombinedPosition \r\n      ? imagePositionVariants({ position: position as 'left-bottom' | 'left-top' | 'right-bottom' | 'right-top' })\r\n      : simplePositionProps[position as keyof typeof simplePositionProps] || '';\r\n\r\n    return (\r\n      <img\r\n        ref={ref}\r\n        data-class=\"image\"\r\n        src={src}\r\n        alt={alt}\r\n        width={width}\r\n        height={height}\r\n        onError={handleError}\r\n        className={cn(\r\n          defaultProps,\r\n          fitClasses,\r\n          positionClasses,\r\n          aspectClasses,\r\n          placeholderClasses,\r\n          utilityClassName,\r\n          className\r\n        )}\r\n        {...rest}\r\n      />\r\n    );\r\n  }\r\n);\r\n\r\nImage.displayName = \"Image\"; ",
      "target": "components/ui"
    }
  ]
}